number,created_at,merged_at,closed_at,files,additions,deletions,body_text,participants,comments
1172,2023-02-20T10:43:47Z,,2023-02-20T16:02:58Z,2,20,6,"This PR proposes updates to the serpapi Python library to add support for multiple search results and currency converter feature.
Problem:
The current implementation of the serpapi Python library fetches only the first search result for a query even if the num parameter is set. This limits the usability of the library to fetch a more comprehensive search result list. Additionally, the library does not support the currency converter feature available in some search engine results pages.
Example:
Before it would scrape:
Bitcoin USD price, real-time (live) charts, news and videos. Learn about BTC value, bitcoin cryptocurrency, crypto trading, and more.
The live price of Bitcoin is $ 24,475.15 per (BTC / USD) today with a current market cap of $ 472.29B USD. 24-hour trading volume is $ 28.68B USD.
February 20, 2023 - The current price of Bitcoin is $24605.78 per (BTC / USD). Bitcoin is 64.23% below the all time high of $68789.63.
The live Bitcoin price today is $24,501.18 USD with a 24-hour trading volume of $29,043,133,446 USD. We update our BTC to USD price in real-time.
Bitcoin's price today is US$24,874.07, with a 24-hour trading volume of $26.63 B. BTC is +1.36% in the last 24 hours. It is currently -1.29% from its 7-day ...
Get Bitcoin/USD Coin Metrics (BTC.CM=:Exchange) real-time stock quotes, news, price and financial information from CNBC.
Bitcoin Price is at a current level of 24642.79, up from 24628.82 yesterday and down from 40073.50 one year ago. This is a change of 0.06% from yesterday ...
Find the latest Bitcoin USD (BTC-USD) price quote, history, news and other vital information to help you with your cryptocurrency trading and investing.
The Bitcoin (BTC) live price today is $24517, changes over 24H (-0.23%). Current market cup is $473.10 B. All given information about Bitcoin (BTC) updated ...

But, it only returned:
Bitcoin USD price, real-time (live) charts, news and videos. Learn about BTC value, bitcoin cryptocurrency, crypto trading, and more.
Solution:
To address the above problem, this PR proposes the following updates to the serpapi library:
Add num parameter to _get_default_params() function: The num parameter is set to a default value of 3 to fetch the top three search results. The returned search results are then concatenated to form a single string.
Update snippet extraction code to handle multiple search results: With the updated num parameter, the library extracts all search results' snippets instead of just the first one. This is done by looping through all the search results and concatenating the snippets.
Add support for currency converter: The library is updated to support currency conversion results available in some search engines. The currency converter result is appended to the end of the snippet string, along with the currency symbol.",2,2
1175,2023-02-20T12:54:44Z,2023-02-20T14:46:45Z,2023-02-20T14:46:45Z,2,32,35,"fix notebook formatting, remove empty cells and add scrolling for long text",2,0
1176,2023-02-20T13:53:01Z,2023-02-21T05:09:40Z,2023-02-21T05:09:40Z,3,6,1,"When I try to import the Class HuggingFaceEndpoint I get an Import Error: cannot import name 'HuggingFaceEndpoint' from 'langchain'. (langchain version 0.0.88)
These two imports work fine: from langchain import HuggingFacePipeline and from langchain import HuggingFaceHub.
So I corrected the import statement in the example. There is probably a better solution to this, but this fixes the Error for me.",2,5
1185,2023-02-20T18:57:22Z,2023-02-21T00:38:43Z,2023-02-21T00:38:44Z,9,41,51,,2,0
1187,2023-02-20T19:20:59Z,2023-02-21T00:39:14Z,2023-02-21T00:39:14Z,2,6,2,"Fixes issue #1186. For some reason, #1117 didn't seem to fix it.",2,0
1191,2023-02-20T23:50:30Z,2023-02-21T02:39:34Z,2023-02-21T02:39:34Z,10,786,5,"Description
This PR adds a wrapper which adds support for the OpenSearch vector database. Using opensearch-py client we are ingesting the embeddings of given text into opensearch cluster using Bulk API. We can perform the similarity_search on the index using the 3 popular searching methods of OpenSearch k-NN plugin:

Approximate k-NN Search use approximate nearest neighbor (ANN) algorithms from the nmslib, faiss, and Lucene libraries to power k-NN search.
Script Scoring extends OpenSearchâ€™s script scoring functionality to execute a brute force, exact k-NN search.
Painless Scripting adds the distance functions as painless extensions that can be used in more complex combinations. Also, supports brute force, exact k-NN search like Script Scoring.

Issues Resolved
#1054",2,1
1195,2023-02-21T03:49:14Z,2023-02-21T05:05:13Z,2023-02-21T05:05:13Z,5,51,50,"There's a lot of valuable data that can come from SerpAPI, more than just a single snippet or answer.
Add a results method which returns the raw api response from serpapi.  It's very useful grabbing snippets and the answer box for crafting context summaries in quality checking answers for recent or more obscure information.

I did make a proactive move to move SerpApiWrapper into langchain.utilities since that was where the other Serp API utilities all were, and it seemed like it might have been a legacy thing.  I tested that backwards compatibility was maintained with SerpApiChain.  Also did a small amount of refactoring to bring in the process_response method into the class so that it was more in line with what I saw with the other utilities.
If this is out of scope or not what you want, let me know, I'm fine pulling those changes out and just including the results method.",2,0
1203,2023-02-21T07:01:17Z,2023-02-25T16:59:53Z,2023-02-25T16:59:53Z,4,42,97,,3,2
1216,2023-02-21T18:08:06Z,2023-02-22T01:03:45Z,2023-02-22T01:03:46Z,1,1,1,Found a typo in the documentation code for the constitutional_ai module,2,0
1217,2023-02-21T18:47:32Z,2023-02-22T01:02:04Z,2023-02-22T01:02:04Z,2,283,53,,2,0
1218,2023-02-21T18:51:06Z,2023-02-27T01:55:28Z,2023-02-27T01:55:28Z,2,44,6,"Checking if weaviate similarity_search kwargs contains ""certainty"" and use it accordingly. The minimal level of certainty must be a float, and it is computed by normalized distance.",2,0
1223,2023-02-22T01:44:55Z,,2023-02-27T22:29:32Z,6,106,4,Add a method pformat that takes in a subset of input_variables and adjusts the PromptTemplate's template and input_variables,3,2
1226,2023-02-22T08:31:59Z,,2023-03-12T00:03:17Z,1,6,4,"This allows for the option to self-host a qdrant server and call it from the code as shown below:
qdrant_client = QdrantClient(host='localhost', port=6333)
qdrant = Qdrant.from_documents(docs, embeddings, client=qdrant_client, prefer_grpc=True)",2,3
1228,2023-02-22T09:10:50Z,2023-02-23T15:33:01Z,2023-02-23T15:33:01Z,1,38,0,Adds a Graphsignal ecosystem page,2,0
1231,2023-02-22T13:04:13Z,2023-02-23T15:32:47Z,2023-02-23T15:32:47Z,1,7,2,"Currently youtube loader only seems to support English audio.
Changed to load videos in the specified language.",2,0
1235,2023-02-22T17:30:19Z,2023-02-22T18:36:15Z,2023-02-22T18:36:15Z,1,1,1,Just fixing a typo I found in loading.py,2,0
1240,2023-02-23T00:43:01Z,2023-03-01T07:18:36Z,2023-03-01T07:18:36Z,12,1488,5,"Inspired by the LLMCheckerChain, which is very useful for checking questions and answers, I found a need to check
if the assertions made in a summarization of unknown texts was factually accurate.
LLMSummarizationCheckerChain follows the pattern of LLMCheckerChain and Fact Checker, but builds on it by
conditionally double/triple/n-checking the regeneration of the ""correct"" summary text.   The llm_summarization_checker.ipynb notebook shows a few examples of different
types of text, and the output.
Other small changes

Changed Prompt.from_file to allow relative to the caller file paths.
Added some more context to one of the prompt parameter checks after spending way too long trying to figure out why it was throwing that exception
Added memory support to sequential chains by fixing the param validation


More details
It does a very good job most of the time, but as always with these models, it tends to hallucinate and gets confused.  If max_checks is set too high,
and the LLM temperature is high, it can get stuck in an infinite loop, hallucinating itself to madness.  On the other hand, if you like to live on the edge, you can set max_checks to one and have it behave
like any other SequentialChain.
Depending on the dataset and type of application, I've found through experimenting with it that the LLM temperature is extremely important.  Keeping it at 0 has yielded the most consistent results, but some unstructured
texts require a little more variety to get somewhere good.
Additionally, it really does have problems with more nuanced facts.  For example, ""Mammals can lay eggs, birds can lay eggs, therefore birds are mammals."".  It has no problem correctly identifying that ""Birds are mammals"" is false.
But the statement ""Mammals can lay eggs"" is technically true - see Platypus' (Nature is weird).  The chain gets to a factually correct end point ""'Birds can lay eggs and are not mammals; they belong to a distinct class of their own, separate from mammals.'""
but along the way, it incorrectly asserted ""Mammals can lay eggs: False. Mammals are not capable of laying eggs, as they give birth to live young."".
It gets to the right answer, but in a long and round-a-bout way.
Other strange prompt observations:

Using the word ""Fact"" instead of ""Assertion"" improved the accuracy of the checked_facts generation.
Pre-prompting with ""Fact-checking reporter"" persona also improved accuracy.
Adding a third ""Undetermined"" option when classifying true/false had the largest impact on the final output.  It seems like giving the LLM an ""out"" if it wasn't confident in the answer prevented some hallucinations.

Hopefully this is useful to someone - there's a lot more you can do down this path like abandoning the check loop after a certain number of tries and firing off a chain that does a SERP scrape or docstore lookup to get context and try again.",3,3
1245,2023-02-23T06:26:25Z,,2023-02-23T15:38:34Z,1,17,1,Fix for issue: #1243,5,7
1252,2023-02-23T16:40:56Z,2023-02-24T15:10:35Z,2023-02-24T15:10:35Z,4,270,0,"NotebookLoader.load() loads the .ipynb notebook file into a Document object.
Parameters:

include_outputs (bool): whether to include cell outputs in the resulting document (default is False).
max_output_length (int): the maximum number of characters to include from each cell output (default is 10).
remove_newline (bool): whether to remove newline characters from the cell sources and outputs (default is False).
traceback (bool): whether to include full traceback (default is False).",2,1
1253,2023-02-23T18:17:37Z,2023-02-23T20:34:45Z,2023-02-23T20:34:45Z,1,0,4,"Summary
Updates the docs to remove the nltk download steps from unstructured. As of unstructured 0.4.14, this is handled automatically in the relevant modules within unstructured.",2,0
1256,2023-02-23T19:01:33Z,2023-02-24T15:21:03Z,2023-02-24T15:21:03Z,1,4,0,"As #798, this commit adds the option to truncate the user's inputs larger than what the model can handle.
This defaults to None in the Cohere SDK instead of directly passing ""NONE"", so I maintained the same default value (see: https://github.com/cohere-ai/cohere-python/blob/7f30bfd40c98b88f7d08f8c05db5b91ddb1310d1/cohere/client.py#L127)
PS: I think that both this and #798 should default to the same value.",2,0
1261,2023-02-23T22:45:54Z,2023-02-24T15:06:07Z,2023-02-24T15:06:07Z,2,12,18,-Address TODOs for err handling on missing keys in wolfram & google search utils,2,0
1262,2023-02-23T22:49:51Z,2023-02-24T15:03:50Z,2023-02-24T15:03:50Z,1,4,1,Adding ability to return Source Documents in ChatVectorDBChain async call.,2,0
1263,2023-02-23T23:15:58Z,2023-02-27T05:47:27Z,2023-02-27T05:47:27Z,6,635,1,"Implements AtlasDB vectorstore for integrating with Atlas by Nomic.
Read more about Atlas at docs.nomic.ai",5,5
1286,2023-02-24T21:42:16Z,2023-02-27T01:54:43Z,2023-02-27T01:54:43Z,1,1,1,"While using a SQLiteCache, if there are duplicate (prompt, llm, idx) tuples passed to update_cache(), then an IntegrityError is thrown. This can happen when there are duplicated prompts within the same batch.
This PR changes the SQLAlchemy session.add() to a session.merge() in cache.py, following the solution from this SO thread. I believe this fixes #983, but not entirely sure since that also involves async
Here's a minimal example of the error:
from pathlib import Path

import langchain
from langchain.cache import SQLiteCache

llm = langchain.OpenAI(model_name=""text-ada-001"", openai_api_key=Path(""/.openai_api_key"").read_text().strip())
langchain.llm_cache = SQLiteCache(""test_cache.db"")
llm.generate(['a'] * 5)
>   IntegrityError: (sqlite3.IntegrityError) UNIQUE constraint failed: full_llm_cache.prompt, full_llm_cache.llm, full_llm_cache.idx
    [SQL: INSERT INTO full_llm_cache (prompt, llm, idx, response) VALUES (?, ?, ?, ?)]
    [parameters: ('a', ""[('_type', 'openai'), ('best_of', 1), ('frequency_penalty', 0), ('logit_bias', {}), ('max_tokens', 256), ('model_name', 'text-ada-001'), ('n', 1), ('presence_penalty', 0), ('request_timeout', None), ('stop', None), ('temperature', 0.7), ('top_p', 1)]"", 0, '\n\nA is for air.\n\nA is for atmosphere.')]
    (Background on this error at: https://sqlalche.me/e/14/gkpj)

After the change, we now have the following
class Output:
    def __init__(self, text):
        self.text = text

# make dummy data
cache = SQLiteCache(""test_cache_2.db"")
cache.update(prompt=""prompt_0"", llm_string=""llm_0"", return_val=[Output(""text_0"")])
cache.engine.execute(""SELECT * FROM full_llm_cache"").fetchall()

# output
>   [('prompt_0', 'llm_0', 0, 'text_0')]
#  update data, before change this would have thrown an `IntegrityError`
cache.update(prompt=""prompt_0"", llm_string=""llm_0"", return_val=[Output(""text_0_new"")])
cache.engine.execute(""SELECT * FROM full_llm_cache"").fetchall()

# output
>   [('prompt_0', 'llm_0', 0, 'text_0_new')]",2,0
1293,2023-02-25T18:23:03Z,2023-03-04T16:01:20Z,2023-03-04T16:01:20Z,9,266,54,"Pulled out of #1240
Working with memory a little bit, it's extremely helpful to attach memory to a sequential chain to pass along unchanging data.  The use case I found was passing along the original text to use as context in each prompt when doing rewrites of text.
It's a lot easier to have a central data store than having to pass along each value as input/output.",2,4
1295,2023-02-25T19:40:39Z,2023-02-27T01:41:03Z,2023-02-27T01:41:03Z,2,94,88,"Thanks for all your hard work!
I noticed a small typo in the bash util doc so here's a quick update. Additionally, my formatter caught some spacing in the .md as well. Happy to revert that if it's an issue.
The main change is just
- A common use case this is for letting it interact with your local file system. 

+ A common use case for this is letting the LLM interact with your local file system.

Testing
make docs_build succeeds locally and the changes show as expected âœŒï¸",2,1
1303,2023-02-26T06:42:46Z,,2023-05-18T23:41:07Z,5,210,0,"In response to #1269, I added an integration using the ArXiv
unofficial SDK.
I don't think it's necessary to use the actual ArXiv API, as lukasschwab's wrapper seems active atm.
Any feedback on the string-like representation is welcome; see line.",4,5
1307,2023-02-26T15:14:45Z,2023-03-15T01:06:03Z,2023-03-15T01:06:03Z,3,457,0,"Description
Add RediSearch vectorstore for LangChain
RediSearch: RediSearch quick start
How to use
from langchain.vectorstores.redisearch import RediSearch

rds = RediSearch.from_documents(docs, embeddings,redisearch_url=""redis://localhost:6379"")",4,17
1308,2023-02-26T16:59:36Z,2023-02-28T16:40:36Z,2023-02-28T16:40:36Z,8,370,14,,2,1
1313,2023-02-27T04:58:21Z,2023-03-03T17:54:18Z,2023-03-03T17:54:18Z,7,174,0,"This PR enables users to transcript audio files and add them to chains using OpenAI's Whisper models on Banana.dev.
TODO

Turn audio_chain_example.py into a notebook",3,1
1325,2023-02-27T16:46:13Z,2023-03-02T05:18:09Z,2023-03-02T05:18:09Z,9,14,14,Fixed typos and links in a few places across documents,2,0
1327,2023-02-27T20:24:18Z,2023-02-27T22:40:44Z,2023-02-27T22:40:44Z,4,11,11,"Fixing a few minor typos in the documentation (and likely introducing other
ones in the process).",2,0
1328,2023-02-27T20:26:45Z,2023-02-27T22:41:13Z,2023-02-27T22:41:13Z,18,90,149,"IMO, it's a bit cleaner to have toolkits in agent_toolkits. Previously, a Toolkit could have imported from agent_toolkit and a create_*_agent could have imported from Toolkit.
example: OpenAPIToolkit needed create_json_agent and create_openapi_agent needed OpenAPIToolkit

Delete unnecessary toolkits (toolkits with only one tool)
Move BaseToolkit to agent_toolkits
Move toolkits to agent_toolkits
update notebooks",2,0
1330,2023-02-27T21:05:02Z,2023-02-27T22:43:32Z,2023-02-27T22:43:32Z,3,160,0,"Summary
Adds a document loader for image files such as .jpg and .png files.
Testing
Run the following using the example document from the unstructured repo.
from langchain.document_loaders.image import UnstructuredImageLoader

loader = UnstructuredImageLoader(""layout-parser-paper-fast.jpg"")
loader.load()",2,0
1333,2023-02-28T01:39:42Z,2023-02-28T04:40:21Z,2023-02-28T04:40:21Z,6,443,0,"iFixit is a wikipedia-like site that has a huge amount of open content on how to fix things, questions/answers for common troubleshooting and ""things"" related content that is more technical in nature.  All content is licensed under CC-BY-SA-NC 3.0
Adding docs from iFixit as context for user questions like ""I dropped my phone in water, what do I do?"" or ""My macbook pro is making a whining noise, what's wrong with it?""  can yield significantly better responses than context free response from LLMs.",2,0
1334,2023-02-28T02:59:34Z,,2023-11-01T22:54:26Z,3,78,15,"Example usage
from langchain.prompts import load_prompt

prompt = load_prompt(""hf://prompts/LLM_Bash/prompt.json"")
prompt.format(question=""Example question"")",5,4
1340,2023-02-28T12:22:43Z,2023-03-01T02:58:23Z,2023-03-01T02:58:24Z,1,2,2,"InvalidTool.run() returns ""{arg}is not a valid tool, try another one."".
However, no function name is actually given in the argument.
This causes LLM to be stuck in a loop, unable to find the right tool.
This may resolve these Issues.
#998
#702",2,0
1347,2023-03-01T00:32:31Z,2023-03-01T02:58:04Z,2023-03-01T02:58:04Z,2,146,1,"Currently, table information is gathered through SQLAlchemy as complete table DDL and a user-selected number of sample rows from each table. This PR adds the option to use user-defined table information instead of automatically collecting it. This will use the provided table information and fall back to the automatic gathering for tables that the user didn't provide information for.
Off the top of my head, there are a few cases where this can be quite useful:

The first n rows of a table are uninformative, or very similar to one another. In this case, hand-crafting example rows for a table such that they provide the good, diverse information can be very helpful. Another approach we can think about later is getting a random sample of n rows instead of the first n rows, but there are some performance considerations that need to be taken there. Even so, hand-crafting the sample rows is useful and can guarantee the model sees informative data.
The user doesn't want every column to be available to the model. This is not an elegant way to fulfill this specific need since the user would have to provide the table definition instead of a simple list of columns to include or ignore, but it does work for this purpose.
For the developers, this makes it a lot easier to compare/benchmark the performance of different prompting structures for providing table information in the prompt.

These are cases I've run into myself (particularly cases 1 and 3) and I've found these changes useful. Personally, I keep custom table info for a few tables in a yaml file for versioning and easy loading.
Definitely open to other opinions/approaches though!",2,1
1356,2023-03-01T07:33:33Z,2023-03-02T04:59:07Z,2023-03-02T04:59:07Z,11,1394,5,,2,1
1357,2023-03-01T08:20:14Z,2023-03-18T20:39:25Z,2023-03-18T20:39:25Z,6,1405,23,"Description
This PR adds a Weights & Biases callback to Langchain, which will allow users to easily track the generations of their interaction with LangChain.

During the duration of the session with Langchain, callback users have the option to log each action performed by the Module to Weights & Biases, alongside the opportunity to analyze the text using complexity metrics such as Flesch-Kincaid, or an option to visualize the text's structure such as Entity Recognition. Details of stdout are automatically saved to the Weights and Biases platform during the context of the callback.
At the end of a session with a module, the generations are logged to Weights and Biases, alongside any selected metrics and visualizations. Users have the ability to also log a table containing all the available information for each callback action that was received, similar to a trace.

As there is no formal finish signal to emit depending on the Langchain Module used to provide generations, we treat the usage of these LLMs similar to a user-defined session, where each session is used to collect many generations for a prompt, test out many different prompts, or different configurations for an LLM.

To serialize the contents of a Langchain module alongside the aforementioned tables to create a contextually tracked model artifact, we add a function to the WandbCallback called flush_tracker which when provided the langchain module to serialize, and some flags controlling the next state of the model for your sessions, will log the aforementioned artifact to Weights and Biases.

This PR includes the following changes:

Added wandb, textstat, spacy en-core-web-sm (3.5.0) and pandas packages to pyproject.toml
Created a new WandbCallback class in wandb_callback.py in langchain/callbacks
Exposed this new callback class in the langchain/callbacks/__.init__.py

Please let me know if there are any issues or concerns with this PR. Thank you for your time and consideration!
Recreating Validation
An example script showing 3 different scenarios using Langchain modules with the WandbCallback have been provided in this colab: https://colab.research.google.com/drive/1DXH4beT4HFaRKy_Vm4PoxhXVDRf7Ym8L?usp=sharing
An example workspace can be found here: https://wandb.ai/a-sh0ts/langchain_callback_demo?workspace=user-a-sh0ts

Under minimal_* it will show the default workspace which will only log during flush, but still track generations and actions during the session.

To recreate the above minimal workspace you can run the collar fully as is


Under full_* it will show the maximal workspace with the tracked values during the session, and the expanded generations table with analysis and visualizations

To recreate features of the above full workspace, set all the appropriate flags to True in the callback of the WandbCallbackHandler



Defaults
Default values for WandbCallbackHandler(...):
visualize: bool = False,
complexity_metrics: bool = False,
stream_logs: bool = False,

Defaults for WandbCallbackHandler.flush_tracker(...):
reset: bool = True,
finish: bool = False,",2,4
1375,2023-03-02T01:55:55Z,,2023-03-09T04:11:26Z,50,3384,477,relevant discussion: #1376,6,0
